"","playlistlikesum","songtitlesum","songlikesum","singersum","songlyricsum"
"1","3280","What If","9042","김재환","So many things I wish I could do better So here I am just dont know what to say 수 많은 생각 많은 감정 그 속에 매일 서 있어 내 무거운 맘을 너는 잘 알아 어디 말할 수 없던 일들까지 난 네 앞에선 하루 종일 달리듯 말해 I didnt know how much I really needed you 늘 기댈 수 있어 편안했던 그런 사이 But what if this is all 내 생각보다 더욱 특별한 편안함보단 어딘가 다른 Oh What if we make it all 텅 비어버린 마음이 커져 갈 때 허전하고 슬퍼 우울해질 땐 난 답을 적듯 당연하게 너에게 가곤 했어 한 걸음 걸음마다 숨이 찼던 나는 어디 멀리 사라져 버려 이 모든 게 다 네 옆에선 가볍기 만해 I didnt know how much I really needed you 늘 기댈 수 있어 편안했던 그런 사이 But what if this is love 소중함보단 조금 커다란 그리움보단 깊은 아련함 Oh What if we make it love What if this is love 떨어질수록 아픈 마음이 지날수록 깊은 감정이 Oh What if this is love 어느 날 네가 없는 날에 견딜 수 없이 아려왔어 그날의 난 알 수 있던 거야 This is called love This is called love This is called love Oh This is called love"
"2","3280","아름다운 한 사람","4705","케이윌","그대의 하얀 얼굴이 맑은 그 눈빛이 내 가슴을 다시 뛰게 만들어 그대의 따뜻한 손이 날 향한 목소리가 나를 안아주네요 이거 하나만 기억해요 그대만 바라보는 진심을 아름다운 내 사람 가슴 떨리게 하는 나만의 한 사람 나에겐 그런 사람 비가 또 내려오면 함께 맞아줄 둘도 없는 그런 사람 바로 그대에요 그대의 좋은 향기가 그대의 미소가 나에겐 세상 전부가 됐으니 떠나가지는 말아요 그대가 없는 나를 생각할 수 없어요 이거 하나만 기억해요 그대 없이 난 안된다는 걸 아름다운 내 사람 가슴 떨리게 하는 나만의 한 사람 나에겐 그런 사람 비가 또 내려오면 함께 맞아줄 둘도 없는 그런 사람 바로 그대에요 때론 슬플 때마다 그대 곁을 지켜줄 그런 사람이 바로 내가 됐으면 내 마음 들리나요 이 마음 보이나요 그대도 같다면 내 곁에 머물러요 아직도 모르나요 그대뿐이죠 계절은 변한다 해도 난 변하지 않죠"
"3","3280","그렇게 넌 내게 빛나","8598","휘인 Whee In","따뜻한 꿈 속에 있나 봐 아직 난 널 바라보고 있어 선명하게 난 느낄 수 있어 혹시 너 꿈에서 깰까 봐 네가 현실에 달아날까 어떤 말도 난 조심스러워 그렇게 너의 곁에 다가가 조용히 나의 맘을 말해볼게 한가지 너의 눈의 진심을 기억해 따뜻한 마음이 난 소중해 그렇게 넌 내게 빛나 오늘이 더 그래 나에게 넌 꿈을 만들어줘 오랫동안 깨지지 않을 그 곳에 난 늘 다시 행복해져 따뜻한 너의 손을 잡아 밤이 새도록 이야기해 시간은 더 우릴 기다려 줘 그렇게 한참 동안을 기대 조용히 나의 맘을 이야기해 한가지 따뜻한 그 말들을 기억해 나에게 준 꿈들을 사랑해 그렇게 넌 내게 빛나 오늘이 더 그래 너의 온도를 느낄 수 있어 아주 가까이 니가 보여 그래서 난 행복할 수 있어 가끔은 너와 나의 거리가 닿지 않을까 두려워져 하지만 눈을 감아보면 그 속엔 온통 너야 내 맘 속엔 온통 너로 가득해 오늘 난 너의 곁에 있을래 따뜻한 너의 맘에 기댈래 이렇게 난 너에게 가 오늘을 기억해 나에게 넌 꿈을 만들어줘 오랫동안 깨지지 않을 그 곳에 난 늘 다시 행복해져"
"4","3280","너의 밤은 어때 취향저격 그녀 X 정은지","14997","정은지","왜 오늘따라 생각이 많은지 눈을 감아도 잠은 오지를 않고 한참을 멍하니 침대 위에 누워서 또 너를 그려보네 오늘 같은 밤엔 궁금해지곤 해 지금 너의 방도 불이 켜져 있을까 나와 같은 달을 보면서 긴 밤을 보내고 있을까 너의 밤은 어때 이렇게 잠 못 드는 밤이면 내가 줬던 꽃다발을 생각하며 한 번쯤은 날 위한 예쁜 미소를 너는 지었을까 나의 밤은 그래 이렇게 잠 못 드는 밤이면 처음 느낀 그날의 향기가 나 오늘도 네가 많이 보고 싶나 봐 유난히 긴 오늘 밤 네가 내 마음을 알아주지 않아도 괜찮을 거라 생각했는데 사실은 저 하늘에 별들처럼 항상 네 곁에 있고 싶어 너의 밤은 어때 이렇게 잠 못 드는 밤이면 내가 줬던 손 편지를 꺼내보며 한 번쯤은 날 위한 예쁜 미소를 너는 지었을까 나의 밤은 그래 이렇게 잠 못 드는 밤이면 처음 느낀 그날의 향기가 나 오늘도 네가 많이 보고 싶나 봐 유난히 긴 오늘 밤 나의 밤은 그래 이렇게 잠들지 못할 때면 자꾸만 너의 모습이 떠올라 생각보다 널 많이 좋아하나 봐 네가 보고픈 이 밤"
"5","3280","My Love","11988","조유리 아이즈원","혼자 나 있어도 그리워져 너의 따스한 미소가 저 햇살마저도 네 눈빛 같아 모두 너로 보여 저 하늘은 너의 품속 같아 저기 구름은 네 얼굴 같아 너의 곁으로 달려가고 싶은데 너무 보고 싶어져 조금만 더 날 기다려주겠니 오래 걸리지는 않을 테니까 혼자 나 있어도 그리워져 너의 따스한 미소가 저 햇살마저도 네 눈빛 같아 모두 너로 보여 my love 괜히 콧노래만 스르둡두 네 생각에 바람은 너의 목소리 같아 나무는 기댈 어깨만 같아 꽃들은 너의 좋은 향기와 같은걸 너의 모든 게 좋아 널 향한 내 고백을 듣고 있니 나의 이 노래를 받아주겠니 혼자 나 있어도 그리워져 너의 따스한 미소가 저 햇살마저도 네 눈빛 같아 모두 너로 보여 my love 너의 품속으로 나 네가 있는 곳에 나 지금 가고 싶어 나 한순간도 널 잊고 싶지 않은데 항상 내 곁에서 있어주겠니 너의 하나하나가 생각나 또 그리워지는 순간"
"6","3280","나의 시간은","37159","백현 BAEKHYUN","한 걸음마다 난 너를 따라 발을 맞춰 나란히 함께 가고 있어 매일 난 니 어깨에 맞춰 나의 팔을 내어 두르면 세상엔 온통 우리만 가득해 Whatever You want Whatever You say 너와 늘 만들어갈게 Whatever You want Whatever You say 니가 늘 웃을 수 있게 니가 보는 난 변하지 않아 그 어떤 이유라도 네게 남을게 지금 모습 이대로 까마득한 내일 지울 수 없는 오늘 불안할 테지만 버거울 걸 알지만 내가 니 손을 잡아 줄 거야 모든 게 바뀌고 많은 날이 가도 나의 시간은 니 곁에 멈출 거야 정신없이 살다 언제 돌아봐도 니 곁에 늘 난 Whatever You want Whatever You say 너와 늘 만들어갈게 Whatever You want Whatever You say 니가 늘 웃을 수 있게 니가 보는 난 변하지 않아 그 어떤 이유라도 네게 남을게 지금 모습 이대로 언젠가는 지금을 떠올리는 날 온다면 반짝이는 순간들로 기억 되어지길 Whatever You want Whatever You say 너와 늘 만들어갈게 Whatever You want Whatever You say 니가 늘 웃을 수 있게 니가 보는 난 변하지 않아 그 어떤 이유라도 네게 남을게 지금 모습 이대로"
"7","3280","우연일까","9606","하성운","언제부터인지 그 미소가 낯설게 느껴져 자꾸 생각하게 돼 한참 생각했어 조금 달라진 내 마음의 조각 넌 알고 있는지 잊지 못한 하루 그 눈빛 네 온기 함께 걸었던 그 거리 그 떨림 전부 다 우연일까 그 작은 떨림이 흔들리는 바람이 뭔가 좀 달라서 다시 널 생각하게 돼 저 밤하늘의 달처럼 더 커져만 가는 너는 우연이었을까 우연이 아닐까 그때는 몰랐어 모든 계절 속에 네가 있단 걸 이제야 알았어 잊지 못한 하루 그 눈빛 네 온기 내게 입 맞추던 입술 그 떨림 전부 다 우연일까 그 작은 떨림이 흔들리는 바람이 뭔가 좀 달라서 다시 널 생각하게 돼 저 밤하늘의 달처럼 더 커져만 가는 너는 우연이었을까 우연일까 그 모든 순간이 너를 향한 마음이 자꾸만 커져서 이젠 숨길 수가 없어 저 밤하늘의 별처럼 나를 비춰주던 너는 우연이었을까 운명이었을까"
"8","3280","내일은 고백할게","17166","태연 TAEYEON","음  think about you you are everything i wanna stay 늘 네 곁에  투명한 널 바라보네 나의 입술이 너를 또 불러보는걸  내 맘을 숨겨도 다 알 것 같아서 두 눈을 본다면 느낄 것 같아서  한걸음 뒤에서 바보처럼 난 서성이지만  i will be on your side 널 바라보면 볼수록 우우우  솔직하게 말을 해줘 너도 나와 같다면 말이야 내 곁에 다가와줘  when i need you just close my eyes  but you dont know 내 진심을  너의 이름을 부르면 올 것만 같아서 혼잣말로 불러보는걸  i will be on your side 널 바라보면 볼수록 우우우  솔직하게 말을 해줘 너도 나와 같다면 말이야 내 곁에 와줘  생각하면 할수록 기억하면 할수록 나는 알아 사랑이란걸 말야  우 잠시 눈을 감아도 보고싶어지는 너야 같이 있고 싶어져  너의 맘을 알고 싶어 우우우  처음 만났을 때부터 지금까지 난 그대로인데 넌 모르지만  always by your side 네 곁에 내가 있고 싶은데  아직 용기가 잘 안 나 한걸음씩 네 곁에 가볼게 내일은 고백할게"
"9","3280","가까운 미래","2724","윤종신","못 보던 일들이 자꾸 일어나는 요즘 우리 이별도 있었네 누가 알았겠어 널 그리워할 날들이 내게 다가올 줄 너는 알고 있었니 불확실한 날엔 니가 있어 꼭 붙잡던 끈 같았던 가까운 미래 세상이 싹 다 망해 버렸으면 내심 바랬어 모두 슬프고 다들 외롭고 위로 따윈 없는 지난 날만 그리운 세상 다가올 날들을 다 그럴 듯 하게 말해 어떻게든 되겠지 어쨌든 넌 없겠지 이러다가 꾸역 꾸역 산다 배시시 실없는 적응 가까운 미래 세상이 싹 다 망해 버렸으면 내심 바랬어 모두 슬프고 다들 외롭고 위로 따윈 없는 지난 날만 그리운 가까운 미래 세상은 역시 모두 이겨내고 힘을 내겠지 나만 지겠지 어설프게 끼어 그 틈에 살아가 지난 날의 너만을 안고"
"10","3280","나만 아는 사랑이었어","3938","KCM","안녕 우리 오래된 사이지만 아직도 어색해 너는 내게 하늘 위에 얹어놓은 예쁜 구름들 같아 많이 좋아한다고 내가 감히 사랑한다고 고백하면 네가 사라질까 봐 그냥 친구로 남기로 할래 예쁘게 기억될 나만 알고 있는 사랑이었어 조금 아프게 조금 오래 간직하고픈 나만 알고 있는 사랑이었어 안녕 이제 아름답게 물들여 맘에 넣어둘래 너는 내게 비 온 뒤에 그려진 예쁜 무지개 같아 많이 좋아한다고 내가 감히 사랑한다고 고백하면 네가 사라질까 봐 편한 친구로 남기로 할래 예쁘게 기억될 나만 알고 있는 사랑이었어 조금 아프게 조금 오래 간직하고픈 나만 알고 있는 사랑이었어 혹시 닿으면 네가 사라질까봐 내가 만지면 네가 없어질까봐 애태우면서 지냈었는데 이제 친구로 남기로 할래 예쁘게 기억해 나만 알고 있는 사랑이니까 너만 모르는 오래 지낸 편한 친구로 나만 알고 있는 사랑이니까 라라라 라라라 라라라라라라 라라 라라라 조금 아프게 조금 오래 간직하고픈 나만 알고 있는 사랑이었어"
"11","3280","별","5233","임한별","Far away I feel you shooting star 오늘도 널 바라보지만 내 기억엔 흐릿하게 남은 너의 숨결뿐이야 너를 느낄 뿐이야 살며시 너를 불러보다 멀어질까 봐 난 두려워져 눈이 부시게 아름다웠던 추억만큼만 내 곁에 있어줘 조금은 가까이 멀리에서도 그리워한 만큼 나를 기억해 줘 Far away Im with you shooting star 여전히 널 그려보는 이 밤 눈 감으면 더 선명해지는 네가 아플 뿐이야 또 그리울 뿐이야 꿈에서마저 널 그리다 깨어날까 봐 난 두려워져 우리 눈이 부시게 아름다웠던 추억만큼만 내 곁에 있어줘 조금은 가까이 멀리에서도 그리워한 만큼 나를 기억해 줘 시간이 또 지나가도 오래도록 머무는 이 자리 그대만의 향기가 남겨져 영원할 수 있는 간절한 바람도 지금도 바라보고 있어 곁에 있어도 그리워지는 널 조금은 가까이 멀리에서도 날 잊지 말아 줘 그곳에 있어줘"
"12","3280","널 사랑했던 한 사람","8878","펀치 Punch","사랑이란 말로 다 얘기할 수 없나 봐 너의 그 말들이 날 슬프게 해 넌 이렇게 떠나가지만 네가 행복할 수 있다면 그걸로 충분해 멀어지는 너의 뒷모습 보면서 기다리라는 말 난 하기가 힘들어 차가워진 눈물까지 이별이라고 할순 없잖아 조금 더 늦지않게 나에게로 돌아와 떨어지는 이 눈물까지가 내가 널 위해 해주는 마지막 인사가 될테니까 잘 지내줘 흐릿해져만 가는 나의 두 눈에 고인 눈물은 여전히 멈추지 않아 널 이렇게 사랑하지만 네가 떠나가야 한다면 웃으며 보낼게 이별은 늘 익숙해지지 않는걸 난 어떻게 해야 널 다 잊을 수 있겠니 차가워진 눈물까지 이별이라고 할순 없잖아 조금 더 늦지않게 나에게로 돌아와 떨어지는 이 눈물까지가 내가 널 위해 해주는 마지막 인사가 될테니까 잘 지내줘 하나만 꼭 하나만 잊지는 말아주길 널 사랑했던 한 사람 안녕이라는 말보다 미소로 너를 보내줄거야 아직도 널 붙잡아 곁에 두고 싶지만 떨어지는 이 눈물까지가 내가 널 위해 해주는 마지막 인사가 될테니까 잘 지내줘"
"13","3280","야작시夜作詩","7616","적재","비가 오면 생각이 나 네가 자주 했던 말 흥얼대는 내 목소리가 빗소릴 닮았다던 바람 소리에 문득 잠에서 깬 이 순간에 네 생각이 다시 잠들래 넌 지금 어디에 있을까 뭘 하고 있을까 새벽이면 자꾸만 그 시절을 살게 돼 비 내리던 어느 여름밤 내 손을 감싸던 너의 온기 그 모든 게 생각나 그 시절을 살게 해 넌 어때 넌 지금 어디에 있을까 뭘 하고 있을까 새벽이면 자꾸만 그 시절을 살게 돼 비 내리던 어느 여름밤 내 손을 감싸던 너의 온기 그 모든 게 생각나 그 시절을 살게 해 넌 어때"
"14","3280","Speechless","5273","스탠딩 에그","시간이 없다면서 나를 재촉하죠 이미 문 앞에 서 기다리는데 한참을 달라진 게 없냐며 나를 바라보죠 이미 눈앞에 그대는 나에게 완벽해 매번 겪는 일이지만 아무 말도 안 나와 너의 눈을 볼 때마다 im speechless 예쁜 미소 한 번으로 그댄 나의 모든 시간을 멈추죠 그저 난 바라볼 수밖에 im speechless 짧은 입맞춤으로도 그댄 나의 맘속 성벽을 허물죠 그저 난 무너질 수밖에 im speechless 말을 하지 않아도 난 숨길 수 없죠 그대가 내게 인사했을 때 느꼈죠 그대가 다 가져갔죠 내 모든 숨도 그대가 다 바꿔놨죠 내 모든 꿈도 im speechless 예쁜 미소 한 번으로 그댄 나의 모든 시간을 멈추죠 그저 난 바라볼 수밖에 im speechless 짧은 입맞춤으로도 그댄 나의 맘속 성벽을 허물죠 그저 난 무너질 수밖에 im speechless 매번 겪는 일이지만 아무 말도 안 나와 너를 눈을 볼 때마다 im speechless 미소 한 번으로 심장을 멈추죠 그저 난 바라볼 수밖에 im speechless 짧은 입맞춤으로도 그댄 나의 맘속 성벽을 허물죠 그저 난 내어줄 수밖에 im speechless"
"15","3280","너의 달빛","8745","첸 CHEN","몇 번을 걸어왔던 길 끝엔 네가 있어서 참 좋았어 지금도 난 행복해 익숙해진 우리의 길 오 변하지 않게 내게 남아줘요 내 곁에서 oh love 깊어진 너의 달빛이 꿈에서 보여요 똑같은 너의 하늘은 몇 번을 더 보아도 난 행복해 나에겐 언제나 넌 꿈이야 이미 넌 충분해 언제나 바래왔던 그 사람 바라만봐도 참 좋았어 그걸로 충분했어 온종일 밤을 새워도 오 너의 생각은 멈춰지지 않아 한순간도 oh love 깊어진 너의 달빛이 꿈에서 보여요 똑같은 너의 하늘은 몇 번을 더 보아도 난 행복해 나에겐 언제나 넌 꿈이야 이미 충분하니까 또 오랜 시간이 흘러 내 손 잡은 사람 너이길 바래 그저 우리 함께 있다면 깊어진 마음이 너를 향해 있어 아프던 지난 날들은 이젠 모두 지워줄게 몇 번을 보아도 언제나 넌 꿈이야 이미 넌 충분해"
"16","3280","밤새 취향저격 그녀 X 카더가든","22317","카더가든","나는 아름다운 꿈을 꾼 건진 모르겠네 눈이 부셨던가 그 순간을 잊을 수가 없네 햇살이 좋은 날 운명처럼 다가온 그대 꽃향기가 날 것 같은 그댄 woo woo woo woo 밤새 잠 못 드는 내 맘 알까요 그댄 알까요 wah uh uh 밤새 고민해요 왜 이럴까요 어떻게 하죠 oh woo woo woo woo woo woo woo woo woo woo woo woo woo woo woo woo woo woo woo 처음 본 그 순간 기억하고 난 기억해요 멈춰진 것 같던 그 시간들 woo woo woo woo 밤새 잠 못 드는 내 맘 알까요 그댄 알까요 wah uh uh 밤새 고민해요 왜 이럴까요 어떻게 하죠 oh woo woo woo woo woo woo woo woo woo woo woo woo woo woo woo woo woo woo woo 가슴 떨려 오는 감정이 느껴져요 wah uh 원했던 그 사랑 그 사람이 왔네요 wah uh 까만 밤 하늘에 그대 얼굴을 그려봐요 깊어지는 내 맘 알아줘요 woo woo woo woo"
"17","3280","HAVE A GOODNIGHT 취향저격 그녀 X 셔누 몬스타엑스 민혁 몬스타엑스","11871","셔누 몬스타엑스","매일 밤 달이 뜨면 까마득한 하늘 그대 보여요 Yeah 솔직히 말해봐요 나는 오늘도 그대가 좋아요 눈을 감았다가 또 떠보면 한 뼘 앞에 예쁜 얼굴을 하고 있는 걸 오늘도 이 밤이 참 아름답네요 나의 품에 안겨봐 아무 걱정 마요 또렷이 기억해요 별이 떨어질 때 소원을 말해요 Ill see you in your love 잠이 오지는 않을 건가 봐요 그대의 작은 숨소리 귓가를 간지럽게 해 유난히 빛나는 그대 하루도 쉽지는 않았죠 참 잘했어 그대 이제 Have a goodnight 지나간 건 잊어요 어지러운 생각은 버려도 돼요 좋은 아침일 거야 그저 이런 기분으로 살아요 지켜내지 못한 약속들도 걱정 마요 괜찮을 거야 좀 더 그대를 믿어봐 Good morning 인사를 해봐요 나의 품에 안겨봐 아무 걱정 마요 또렷이 기억해요 별이 떨어질 때 소원을 말해요 Ill see you in your love 잠이 오지는 않을 건가 봐요 그대의 작은 숨소리 귓가를 간지럽게 해 유난히 빛나는 그대 하루도 쉽지는 않았죠 그대 이제 Have a goodnight 눈을 마주 보며 입을 맞추고 그댈 안아줄 항상 곁에 있는 나를 잊지는 말아요 Ill see you in your love 잠이 오지는 않을 건가 봐요 그대의 작은 숨소리 귓가를 간지럽게 해 유난히 빛나는 그대 하루도 쉽지는 않았죠 참 잘했어 그대 이제 Have a goodnight Have a goodnight"
"18","3280","Feel You","10071","신용재 2F","아직 널 기억해 밤하늘 별들의 길처럼 빛났었지 아무 방향 없이 마른 공기를 헤매던 내게 와주었어 어쩌면 잘못된 선택일지 몰라 그저 미안해 이 이야기의 끝이 어디일지는 몰라도 가야만 해 I feel you 운명처럼 느껴 위험이어도 힘에 겨워도 이 숨이 뛰는 순간순간 놓지 않을게 너를 위해서 I feel you 거친 폭풍 한가운데를 향해도 겁내지 않게 해줘 이렇게 너에게로 멈추지 않게 해 널 지킬 수 있게 후회는 하지 않을 거야 가시길 같은 이 거짓 속에서 상처뿐이라 해도 널 사랑했던 건 내 삶이 있던 이유였어 그것뿐이야 지나는 바람에 이 마음을 실어 보내주길 전해주길 해와 달이 없는 내 세상엔 오직 너만이 이 꽃을 피워내 I feel you 운명처럼 느껴 위험이어도 힘에 겨워도 이 숨이 뛰는 순간순간 놓지 않을게 너를 위해서 I feel you 거친 폭풍 한가운데를 향해도 겁내지 않게 해줘 이렇게 너에게로 멈추지 않게 해 널 지킬 수 있게"
"19","3280","Close To Me","4552","펀치 Punch","stay with me close to me stay with me lean on me 늘 내 곁에 있던건 언제나 너였었어 날 위로해준건 i cant believe i dont believe 곁에 있어줘 영원토록 이젠 너 없이는 나 하루도 버틸 수가 없게 됐어 its you stay with me close to me stay with me lean on me 난 네 곁에 있을게 약속해 너를 떠날 이유란건 없어 i cant believe i dont believe 곁에 있어줘 영원토록 이젠 너 없이는 나 하루도 모든 순간이 힘들단걸 아니까 많이 아플 때도 가끔은 지칠 때도 네가 있어서 또 너라서 괜찮아 oh love 지켜줄게 기다릴게 너란 이유로 하나로 이젠 너 없이는 나 하루도 안될 것 같아 지금도 its you"
"20","3280","듣고 싶던 말","11412","허각","너는 모르지 네 생각뿐인 날 모르지 그런 거지 이 바보야 이 바보야 왜 또 울어 더 속상하게 말도 안 되는 거 알고 있지만 이렇게라도 너를 보고 싶었어 하지만 달라질 게 없겠지 이미 다 끝난 거겠지 듣고 싶던 말이 아직도 남아서 잠도 잘 못 자 익숙함에 외면했었던 사랑한다던 고마운 그 말이 이렇게 날 아프게 할지 몰랐었어 시간이 내게 돌아와 준다면 네가 와 준다면 하루하루 내가 다시는 울지 않게 널 안아줄게 혼자서 하는 다짐 속에 너를 느껴 조금 길어진 저녁 그림자 내릴 때쯤 그리워져 괜찮다 했는데 아니었나 봐 웃다가 또 울다가 생각나게 해 어쩌면 너도 나와 같을까 혼자서 아프진 않을까 듣고 싶던 말이 아직도 남아서 잠도 잘 못 자 익숙함에 외면했었던 사랑한다던 고마운 그 말이 이렇게 날 아프게 할지 몰랐었어 시간이 내게 돌아와 준다면 네가 와 준다면 하루하루 내가 다시는 울지 않게 널 안아줄게 혼자서 하는 다짐 속에 너를 느껴 하나 둘 비웠던 네 마음 다 알아서 용기가 안 나 지금이라도 너를 당장이라도 꼭 너를 끌어안고 붙잡고 싶어 하고 싶은 말이 아직도 남아서 미련이 많아서 너를 울려 후회됐었던 아프게 했던 미안한 그 말이 내게 돌아올지 몰랐어 시간이 내게 돌아와 준다면 네가 와 준다면 하루하루 내가 다시는 울지 않게 널 안아줄게 혼자 하는 다짐 속에 너를 느껴"
